[
  {
    "id": "upd-001",
    "raw": "Done: finished the extraction prompt v1 and tested it on 5 messages. Next: write the JSON schema and hook it into the parser. No blockers. Committed to having the schema done by EOD today.",
    "member_id": "dev-a",
    "standup_date": "2026-10-21",
    "source": "synthetic",
    "done": [
      { "text": "finished extraction prompt v1 and tested on 5 messages", "origin": "reported", "task_id": null }
    ],
    "next": [
      { "text": "write the JSON schema and hook it into the parser", "origin": "reported", "task_id": null }
    ],
    "blockers": [],
    "task_ids": [],
    "commitments": [
      { "text": "JSON schema done by EOD", "origin": "reported", "due_date": "2026-10-21", "date_type": "explicit", "task_id": null }
    ],
    "notes": "Clean baseline — all fields explicit."
  },
  {
    "id": "upd-002",
    "raw": "Yesterday I worked on #3668 and #3667. The leakage test is done. Still need to label more examples — probably finish tomorrow. Blocked waiting for Vimal to share the real board messages.",
    "member_id": "dev-b",
    "standup_date": "2026-10-21",
    "source": "synthetic",
    "done": [
      { "text": "leakage test done", "origin": "reported", "task_id": "3668" }
    ],
    "next": [
      { "text": "label more examples", "origin": "reported", "task_id": "3667" }
    ],
    "blockers": [
      { "text": "waiting for Vimal to share real board messages", "origin": "reported", "task_id": "3667", "owner_id": "dev-vimal" }
    ],
    "task_ids": [
      { "task_id": "3668", "origin": "reported", "mention": "#3668" },
      { "task_id": "3667", "origin": "reported", "mention": "#3667" }
    ],
    "commitments": [
      { "text": "finish labelling examples", "origin": "reported", "due_date": "2026-10-22", "date_type": "explicit", "task_id": "3667" }
    ],
    "notes": "Two task ids, one blocker with owner, 'tomorrow' resolved to next calendar day."
  },
  {
    "id": "upd-003",
    "raw": "Nothing new from yesterday, was in meetings all day. Today will try to get the scheduler wired up.",
    "member_id": "dev-c",
    "standup_date": "2026-10-21",
    "source": "synthetic",
    "done": [],
    "next": [
      { "text": "wire up the scheduler", "origin": "reported", "task_id": null }
    ],
    "blockers": [],
    "task_ids": [],
    "commitments": [
      { "text": "wire up the scheduler", "origin": "inferred", "due_date": "2026-10-22", "date_type": "implied", "task_id": null }
    ],
    "notes": "No done items (meetings). Next item inferred as implied commitment due next stand-up."
  },
  {
    "id": "upd-004",
    "raw": "Done the auth middleware refactor (#3101). Found a bug in the token refresh path — it's blocking the login flow. I need the API spec from the backend team before I can fix it. Will review PRs today.",
    "member_id": "dev-a",
    "standup_date": "2026-10-21",
    "source": "synthetic",
    "done": [
      { "text": "auth middleware refactor", "origin": "reported", "task_id": "3101" }
    ],
    "next": [
      { "text": "review PRs", "origin": "reported", "task_id": null }
    ],
    "blockers": [
      { "text": "need API spec from backend team to fix token refresh bug", "origin": "reported", "task_id": "3101", "owner_id": null }
    ],
    "task_ids": [
      { "task_id": "3101", "origin": "reported", "mention": "#3101" }
    ],
    "commitments": [],
    "notes": "Blocker owner is unknown (backend team not a named individual). No explicit commitment date."
  },
  {
    "id": "upd-005",
    "raw": "Same as yesterday, still on the dashboard. Should be done Friday.",
    "member_id": "dev-b",
    "standup_date": "2026-10-21",
    "source": "synthetic",
    "done": [],
    "next": [
      { "text": "continue dashboard work", "origin": "inferred", "task_id": null }
    ],
    "blockers": [],
    "task_ids": [],
    "commitments": [
      { "text": "dashboard done", "origin": "reported", "due_date": "2026-10-23", "date_type": "explicit", "task_id": null }
    ],
    "notes": "Minimal update. Next inferred from 'same as yesterday'. Friday resolved to 2026-10-23. No task id — Q5 should fire."
  },
  {
    "id": "upd-006",
    "raw": "Finished #3674 and pushed to review. Starting #3679 deadline tracking today. No issues.",
    "member_id": "dev-c",
    "standup_date": "2026-10-21",
    "source": "synthetic",
    "done": [
      { "text": "finished and pushed to review", "origin": "reported", "task_id": "3674" }
    ],
    "next": [
      { "text": "start deadline tracking", "origin": "reported", "task_id": "3679" }
    ],
    "blockers": [],
    "task_ids": [
      { "task_id": "3674", "origin": "reported", "mention": "#3674" },
      { "task_id": "3679", "origin": "reported", "mention": "#3679" }
    ],
    "commitments": [],
    "notes": "Dev says done on #3674 — Q2 should fire if Odoo still shows In Progress."
  },
  {
    "id": "upd-007",
    "raw": "Blocked on the Odoo API key — still waiting. Can't make progress on board reads until it's sorted. Nothing else to report.",
    "member_id": "dev-a",
    "standup_date": "2026-10-21",
    "source": "synthetic",
    "done": [],
    "next": [],
    "blockers": [
      { "text": "waiting for Odoo API key", "origin": "reported", "task_id": null, "owner_id": null }
    ],
    "task_ids": [],
    "commitments": [],
    "notes": "Pure blocker, no done or next. Owner unknown. Q7 fires day 2 if still open."
  },
  {
    "id": "upd-008",
    "raw": "Wrapped up the eval harness. Also fixed that HTML escaping bug we discussed. Next I'll write the replay test and the allow-list test — aiming to have both by Wednesday.",
    "member_id": "dev-b",
    "standup_date": "2026-10-21",
    "source": "synthetic",
    "done": [
      { "text": "completed eval harness", "origin": "reported", "task_id": null },
      { "text": "fixed HTML escaping bug", "origin": "reported", "task_id": null }
    ],
    "next": [
      { "text": "write replay test", "origin": "reported", "task_id": null },
      { "text": "write allow-list test", "origin": "reported", "task_id": null }
    ],
    "blockers": [],
    "task_ids": [],
    "commitments": [
      { "text": "replay test and allow-list test done", "origin": "reported", "due_date": "2026-10-21", "date_type": "explicit", "task_id": null }
    ],
    "notes": "Two done, two next, one commitment covering both. Wednesday = 2026-10-21."
  },
  {
    "id": "upd-009",
    "raw": "on leave today",
    "member_id": "dev-c",
    "standup_date": "2026-10-21",
    "source": "synthetic",
    "done": [],
    "next": [],
    "blockers": [],
    "task_ids": [],
    "commitments": [],
    "notes": "Absent / leave. All arrays empty. Bot skips follow-ups for this member today."
  },
  {
    "id": "upd-010",
    "raw": "Done: reviewed Ritika's PR on the schema (#3668), left comments. Working on the CLI adapter today — trying to get open→collect→close working end to end. If the fake clock works I'll also run the 3-day continuity test. Might need help from Vimal on the Teams spike if we get there.",
    "member_id": "dev-a",
    "standup_date": "2026-10-21",
    "source": "synthetic",
    "done": [
      { "text": "reviewed PR on the schema, left comments", "origin": "reported", "task_id": "3668" }
    ],
    "next": [
      { "text": "build CLI adapter open→collect→close end to end", "origin": "reported", "task_id": null },
      { "text": "run 3-day continuity test with fake clock", "origin": "inferred", "task_id": null }
    ],
    "blockers": [],
    "task_ids": [
      { "task_id": "3668", "origin": "reported", "mention": "#3668" }
    ],
    "commitments": [],
    "notes": "Conditional next item ('if the fake clock works') inferred — not a firm commitment."
  },
  {
    "id": "upd-011",
    "raw": "Two blockers today: the staging DB is down so I can't run integration tests, and I'm still waiting on design sign-off for the report layout. Both are blocking #3685. Otherwise done reviewing the gate criteria doc.",
    "member_id": "dev-b",
    "standup_date": "2026-10-22",
    "source": "synthetic",
    "done": [
      { "text": "reviewed gate criteria doc", "origin": "reported", "task_id": null }
    ],
    "next": [],
    "blockers": [
      { "text": "staging DB is down, cannot run integration tests", "origin": "reported", "task_id": "3685", "owner_id": null },
      { "text": "waiting on design sign-off for report layout", "origin": "reported", "task_id": "3685", "owner_id": null }
    ],
    "task_ids": [
      { "task_id": "3685", "origin": "reported", "mention": "#3685" }
    ],
    "commitments": [],
    "notes": "Multiple blockers on the same task. No next items because blockers prevent progress."
  },
  {
    "id": "upd-012",
    "raw": "Finished the commitment ledger state machine. I'll get the blocker ledger done too — no hard deadline but want it done before end of week.",
    "member_id": "dev-c",
    "standup_date": "2026-10-22",
    "source": "synthetic",
    "done": [
      { "text": "commitment ledger state machine done", "origin": "reported", "task_id": null }
    ],
    "next": [
      { "text": "build blocker ledger", "origin": "reported", "task_id": null }
    ],
    "blockers": [],
    "task_ids": [],
    "commitments": [
      { "text": "blocker ledger done before end of week", "origin": "reported", "due_date": "2026-10-23", "date_type": "explicit", "task_id": null }
    ],
    "notes": "Soft deadline 'end of week' resolved to 2026-10-23 (Friday). Not truly implied since dev stated it."
  },
  {
    "id": "upd-013",
    "raw": "Still working on the teams integration spike. Almost there — just need to prove the bot can receive replies without an @mention. Might take the rest of the day.",
    "member_id": "dev-a",
    "standup_date": "2026-10-22",
    "source": "synthetic",
    "done": [],
    "next": [
      { "text": "prove Teams bot can receive replies without @mention", "origin": "reported", "task_id": null }
    ],
    "blockers": [],
    "task_ids": [],